{
  "id": "JOB_ID",
  "name": "TestSchedulerJob",
  "description": "A test scheudler job that when triggered will call scheduler service to schedule a new job",
  "type": "REST",
  "parameters": {
    "endpointDefinition": {
      "baseUri": "http://localhost:8080/mi-service/command/api/rest/mi",
      "resource": "/generate-case-report",
      "mediaType": "mi.command.generate-case-report",
      "queryParams": [
        "xyz"
      ]
    },
    "method": "POST",
    "envelope": {
      "_metadata": {
        "id": "861c9430-7bc6-4bf0-b549-6534394b8d65",
        "name": "mi.command.generate-case-report",
        "correlation": {
          "client": "d51597dc-2526-4c71-bd08-5031c79f11e1"
        },
        "context": {
          "session": "45b0c3fe-afe6-4652-882f-7882d79eadd9",
          "user": "72251abb-5872-46e3-9045-950ac5bae399"
        }
      },
      "payload": {
        "caseId": "JOB_ID",
        "URN": "jhgjhg",
        "xyz": "jhgjhg",
        "abc": "jhgjhg",
        "adsfa": ""
      }
    }
  },
  "cronExpression": "0/2 * * * * ?"
}
